text,label,source
Claim your loan approved by sending <PERSON> immediately.,S4_LoanJob,mendeley_financial
"Your account has been suspended, verify <PERSON> now!",S1_AccountCompromise,mendeley_financial
Please ignore unknown SMS.,L0_Ham,mendeley_financial
Payment received successfully.,L0_Ham,mendeley_financial
Send your <PERSON> to claim your prize!,S3_LotteryPrize,mendeley_financial
Your debit card has been blocked.,S1_AccountCompromise,mendeley_financial
"New offers available, accept <DATE_TIME>!",L0_Ham,mendeley_financial
"Your account is at risk, immediate action required.",L0_Ham,mendeley_financial
"Your mobile recharge was successful, thank you.",L0_Ham,mendeley_financial
"Your loan application is approved, send <PERSON> now!",S4_LoanJob,mendeley_financial
Account hacked! Open the app now to secure it.,L0_Ham,mendeley_financial
Update your account details to avoid suspension.,L0_Ham,mendeley_financial
Thank you for using our service.,L0_Ham,mendeley_financial
"নতুন অফার এসেছে, আজই <PERSON>।",L0_Ham,mendeley_financial
Claim your loan approved by sending <PERSON>.,S4_LoanJob,mendeley_financial
"Fraudulent transaction detected, provide OTP.",S1_AccountCompromise,mendeley_financial
"Your account suspended, verify <PERSON> now!",S1_AccountCompromise,mendeley_financial
সাবধান! আপনার একাউন্ট থেকে অস্বীকৃত টাকা উত্তোলন হয়েছে। জরুরি যাচাই করুন।,L0_Ham,mendeley_financial
"আপনার মোবাইল ব্যাংকিং একাউন্ট বন্ধ হতে যাচ্ছে, এখনি লগইন করুন।",S1_AccountCompromise,mendeley_financial
"আপনার একাউন্ট চালু রয়েছে, সর্বশেষ ব্যালেন্স ১০,০০০ টাকা।",L0_Ham,mendeley_financial
"ডেবিট <DATE_TIME> সীমিত <PERSON>, অন্যথায় একাউন্ট ব্লক হবে।",S1_AccountCompromise,mendeley_financial
নতুন অফার! আপনার একাউন্টে নগদ টাকা রিফান্ড করা হয়েছে,L0_Ham,mendeley_financial
ব্যাংকের তরফ থেকে জরুরি বার্তা: আপনার একাউন্ট আপডেট করুন আজই।,L0_Ham,mendeley_financial
"আপনার মোবাইল ব্যাংকিং PIN পরিবর্তন করা হয়েছে, যদি না করেন তবে রিপোর্ট করুন।",L0_Ham,mendeley_financial
একাউন্ট সিকিউরিটি হুমকি! নিম্নলিখিত OTP দিয়ে যাচাই সম্পন্ন করুন।,S1_AccountCompromise,mendeley_financial
আপনার ব্যালেন্স ৫০০০ টাকার নিচে এসে গেছে।,L0_Ham,mendeley_financial
"আপনার ডেবিট কার্ডের নিরাপত্তা লঙ্ঘিত হয়েছে, অবিলম্বে যাচাই করতে OTP দিন।",S1_AccountCompromise,mendeley_financial
"আপনার ডেবিট কার্ড থেকে ৫০০০ টাকা কাটা হয়েছে, অবিলম্বে TRX কোড পাঠান।",L0_Ham,mendeley_financial
Congratulations! You won a prize. Please send <PERSON> to claim.,S3_LotteryPrize,mendeley_financial
আপনার মোবাইল অ্যাপ্লিকেশন আপডেট সফল হয়েছে।,L0_Ham,mendeley_financial
নিরাপত্তার জন্য আপনার ফোন থেকে আমাদের কনফার্মেশন চান।,L0_Ham,mendeley_financial
Your debit card transaction of 5000 taka was declined. Contact support.,L0_Ham,mendeley_financial
Update your payment information immediately to avoid suspension.,L0_Ham,mendeley_financial
Refund of 100 taka has been processed to your account.,L0_Ham,mendeley_financial
Your online banking password expired. Reset it via the provided link.,S6_PhishingLink,mendeley_financial
Your account balance is low. Add funds to continue service.,L0_Ham,mendeley_financial
"To secure your account, provide the <PERSON> sent to your registered phone.",L0_Ham,mendeley_financial
Payment of 2500 <PERSON> received. Thanks for banking with us,L0_Ham,mendeley_financial
Your credit card limit has been increased. Check details in app.,L0_Ham,mendeley_financial
Verify your identity to avoid account suspension. OTP required.,S1_AccountCompromise,mendeley_financial
Your request to withdraw 5000 taka was successful.,L0_Ham,mendeley_financial
Last chance: Provide <PERSON> to claim your prize money now.,S3_LotteryPrize,mendeley_financial
Your scheduled payment will be processed <DATE_TIME>.,L0_Ham,mendeley_financial
Alert! Unauthorized login attempt detected. Confirm with <PERSON> immediately.,S1_AccountCompromise,mendeley_financial
"Your internet banking password expired, reset it <DATE_TIME> to avoid service disruption.",S1_AccountCompromise,mendeley_financial
"Congratulations! You won BDT 5,000 cashback. Submit OTP to receive.",S1_AccountCompromise,mendeley_financial
Verify your identity by entering the <PERSON> sent to your mobile to continue transactions.,S1_AccountCompromise,mendeley_financial
Your debit card ending 1234 has been temporarily blocked for suspicious activity.,S1_AccountCompromise,mendeley_financial
"BDT 35,000 loan approved. Confirm by sending <PERSON> within <DATE_TIME>.",S4_LoanJob,mendeley_financial
"OTP validation required to complete your BDT 20,000 transfer.",S1_AccountCompromise,mendeley_financial
"Your recent transaction of BDT 7,500 has been verified",L0_Ham,mendeley_financial
Secure your account now! <PERSON> sent to your registered contact.,L0_Ham,mendeley_financial
"BDT 15,000 payment received from your account.",L0_Ham,mendeley_financial
"Your loan payment of BDT 10,000 is overdue. Please pay immediately to avoid penalties.",S4_LoanJob,mendeley_financial
New job opportunity with high salary. Send your CV to apply immediately.,S4_LoanJob,mendeley_financial
Exclusive offer: Double your money in <DATE_TIME> with our secret scheme.,S2_FakePromo,mendeley_financial
"Your lottery ticket won BDT 1,00,000. Send your details for prize delivery.",S3_LotteryPrize,mendeley_financial
Join our online trading platform for guaranteed profits.,L0_Ham,mendeley_financial
Beware of strangers asking for your financial details over chat or SMS.,L0_Ham,mendeley_financial
Your KYC verification is complete. Thank you for your cooperation.,L0_Ham,mendeley_financial
"Earn BDT 2,000 <DATE_TIME> working from home. Register now!",S4_LoanJob,mendeley_financial
Congratulations! You are shortlisted for a luxury car giveaway.,L0_Ham,mendeley_financial
Investment opportunity with zero risk and high returns. Contact us.,S4_LoanJob,mendeley_financial
Avoid fake schemes promising overnight wealth. Stay cautious.,L0_Ham,mendeley_financial
Free smartphone giveaway for lucky winners. Reply to participate.,S2_FakePromo,mendeley_financial
Your online order has been shipped successfully.,L0_Ham,mendeley_financial
Your health insurance claim has been approved. Contact for details.,L0_Ham,mendeley_financial
বিশাল বিনিয়োগের সুযোগ! দ্রুত আজই ফোন করুন।,L0_Ham,mendeley_financial
আপনার লাইভ লটারি জেতা হয়েছে! এখনই প্রমাণ পাঠান।,S3_LotteryPrize,mendeley_financial
অবৈধ আর্থিক লেনদেন এড়ানোর জন্য সতর্ক থাকুন।,L0_Ham,mendeley_financial
দ্রুত বিনিয়োগ করুন এবং মাসে কোটি টাকা উপার্জন করুন।,L0_Ham,mendeley_financial
আপনার একটি চূড়ান্ত সুযোগ! আজই অংশ নিন এবং বড় লাভ করুন।,L0_Ham,mendeley_financial
বিনামূল্যে ব্যাংক সাবসক্রিপশন পেতে আজই যোগাযোগ করুন।,L0_Ham,mendeley_financial
বনধের পরিসীমা থেকে প্রাইভেট জেনারেশন শুরু হয়েছে। <PERSON>।,L0_Ham,mendeley_financial
হারানো পণ্য পুনরুদ্ধার করতে আমাদের সাথে যোগাযোগ করুন।,L0_Ham,mendeley_financial
দ্রুত উপার্জনের জন্য আজই যোগ দিন। প্রতিদিন BDT 2000 থেকে BDT 5000 পর্যন্ত উপার্জন।,L0_Ham,mendeley_financial
বিনিয়োগের জন্য দুর্দান্ত সুযোগ! ব্যাঙ্কের পার্টনারশিপে বড় লাভ।,L0_Ham,mendeley_financial
"আপনার একাউন্ট থেকে অজানা লেনদেন হয়েছে, দ্রুত যাচাই করুন।",L0_Ham,mendeley_financial
"আপনার মোবাইল রিচার্জ সফল হয়েছে, <PERSON>।",L0_Ham,mendeley_financial
জরুরি! OTP দিয়ে একাউন্ট যাচাই করুন না হলে ব্লক হবে।,S1_AccountCompromise,mendeley_financial
"আজকের বিশেষ অফার থেকে সুযোগ নিন, আজই কল করুন।",S2_FakePromo,mendeley_financial
"আপনার লোন আবেদন সফল হয়েছে, ফর্ম <PERSON> জন্য OTP প্রদান করুন।",S1_AccountCompromise,mendeley_financial
আপনার জয়েন্ট অ্যাকাউন্টে সন্দেহজনক লেনদেন হয়েছে।,L0_Ham,mendeley_financial
সতর্কতা: অজানা নম্বর থেকে কল আসলে অবহেলা করুন।,L0_Ham,mendeley_financial
"আজকের <DATE_TIME> সফল হয়েছে, পণ্য গ্রহণের জন্য ধন্যবাদ।",L0_Ham,mendeley_financial
Your package has been shipped. Track your delivery at this link.,L0_Ham,mendeley_financial
Congratulations! You've won a free gift card. Click now to claim.,S6_PhishingLink,mendeley_financial
Our records show suspicious activity in your account. Contact support.,L0_Ham,mendeley_financial
Your subscription is about to expire. Renew now for uninterrupted service.,L0_Ham,mendeley_financial
You have an overdue bill of BDT 3000. Pay immediately to avoid disconnect.,L0_Ham,mendeley_financial
Loan approved! Send your details to receive funds <DATE_TIME>.,S4_LoanJob,mendeley_financial
Fake invoice attached. Please review and click the link to pay.,S6_PhishingLink,mendeley_financial
Your car insurance claim has been approved. Contact us to finalize.,L0_Ham,mendeley_financial
It’s your last chance to claim your cashback. Act now!,S2_FakePromo,mendeley_financial
"You have been selected for a surveys. Complete now and win BDT 10,000.",S3_LotteryPrize,mendeley_financial
Attention! Your mobile data plan will expire <DATE_TIME>. Renew now.,L0_Ham,mendeley_financial
Fake urgent message: You owe BDT 500 for missed payment. Pay now.,L0_Ham,mendeley_financial
Your bank account is locked. Verify now to regain access.,S1_AccountCompromise,mendeley_financial
Limited-time deal: Buy now and get 50% discount on all products.,S2_FakePromo,mendeley_financial
Mystery shopping opportunity! Earn BDT <DATE_TIME>. Sign up now.,S1_AccountCompromise,mendeley_financial
Your recent transaction of BDT 4200 was successfully processed.,L0_Ham,mendeley_financial
Your gaming account has been hacked. Change your password immediately.,S1_AccountCompromise,mendeley_financial
"অবিলম্বে আপনার একাউন্ট যাচাই করুন, না হলে এটি বন্ধ হয়ে যাবে।",S1_AccountCompromise,mendeley_financial
"আজকের বিশেষ ছাড়ে অংশ নিন, আজই যোগাযোগ করুন।",S2_FakePromo,mendeley_financial
"আপনার লোন আবেদন সফল, দ্রুত OTP দিন যাচাইয়ের জন্য।",S1_AccountCompromise,mendeley_financial
মোবাইল বিল বাবদ ৫০০ টাকা সফলভাবে পরিশোধ হয়েছে।,L0_Ham,mendeley_financial
"Hello from BLOrange club. For <DATE_TIME> free access to games, news and sport, plus 10 free texts and 20 photo messages, reply YES. Terms apply: <URL>",S6_PhishingLink,mendeley_financial
Call FREEPHONE +8800 <DATE_TIME> now!,S2_FakePromo,mendeley_financial
"7 wonders in My WORLD 7th You 6th Ur style 5th Ur smile <DATE_TIME> Ur Nature 2nd Ur SMS and <DATE_TIME> Lovely Friendship\""... good morning dear""",L0_Ham,mendeley_financial
"Loan for any purpose 500 tk- 75,000tk. Homeowners + Tenants welcome. Have you been previously refused? We can still help. Call Free +880 <DATE_TIME> or text back 'help'",S2_FakePromo,mendeley_financial
How. Its a little difficult but its a simple way to enter this place,L0_Ham,mendeley_financial
Your package delivery is delayed. Track now at this fake link.,S6_PhishingLink,mendeley_financial
Your job application was successful! Reply to claim your position,S4_LoanJob,mendeley_financial
Verify your phone number now to avoid service interruption.,S1_AccountCompromise,mendeley_financial
Free $1000 gift card! Click here to redeem before it expires.,S6_PhishingLink,mendeley_financial
Your recent online purchase has been shipped successfully.,L0_Ham,mendeley_financial
Your electricity bill of BDT 3000 is overdue. Pay now to avoid cut-off.,L0_Ham,mendeley_financial
Payment of BDT 5000 received. Thank you for your timely payment.,L0_Ham,mendeley_financial
Your subscription payment failed. Update billing info to continue.,L0_Ham,mendeley_financial
Your ticket to the concert is confirmed. Thank you for your purchase.,L0_Ham,mendeley_financial
"Important: Claim your tax refund of BDT 8,000 <DATE_TIME> via this link",S6_PhishingLink,mendeley_financial
Your online account will be suspended soon. Verify credentials now.,S1_AccountCompromise,mendeley_financial
Your medical insurance claim has been processed successfully.,L0_Ham,mendeley_financial
You have unclaimed cashback waiting. Submit your details to claim it immediately.,S2_FakePromo,mendeley_financial
Congratulations! Claim your exclusive shopping voucher by replying with YES.,S1_AccountCompromise,mendeley_financial
"You are eligible to claim a BDT 3,000 bonus from your telecom operator.",S2_FakePromo,mendeley_financial
Claim your prize by verifying your phone number within <DATE_TIME>.,S1_AccountCompromise,mendeley_financial
Claim your loan disbursed amount now by confirming your bank details.,S4_LoanJob,mendeley_financial
Claim your free ticket for the concert happening near you <DATE_TIME>.,S2_FakePromo,mendeley_financial
"You have been selected to claim a new government subsidy, respond with your ID",S5_Impersonation,mendeley_financial
Claim your refund for the recent transaction now before the offer expires.,S2_FakePromo,mendeley_financial
Claim your mystery gift by sending a reply with your full name and address.,S3_LotteryPrize,mendeley_financial
Claim your free mobile upgrade by confirming your account info via SMS.,S2_FakePromo,mendeley_financial
You have a new message from the lottery office. Claim your winnings ASAP.,S3_LotteryPrize,mendeley_financial
Claim your prize money by paying a small processing fee at the link below,S6_PhishingLink,mendeley_financial
"Claim your BDT 15,000 bonus credits from our new app by signing up now.",S2_FakePromo,mendeley_financial
Claim your tax refund by uploading your financial documents immediately.,L0_Ham,mendeley_financial
Your BDT 2000 payment has been received. Thank you for using our service.,L0_Ham,mendeley_financial
Congratulations! You have been selected for a free smartwatch. Reply YES.,S2_FakePromo,mendeley_financial
Your electricity bill of BDT 1500 is due <DATE_TIME>. Please pay on time.,L0_Ham,mendeley_financial
Your mobile recharge of BDT 500 was successful.,L0_Ham,mendeley_financial
"Last chance to claim your cashback offer worth BDT 10,000!",S2_FakePromo,mendeley_financial
You won an exclusive holiday package. Contact us immediately to claim.,L0_Ham,mendeley_financial
Your online subscription has been renewed successfully,L0_Ham,mendeley_financial
Warning! Your account has been suspended due to suspicious activity.,S1_AccountCompromise,mendeley_financial
Enjoy 20% discount on your next purchase. Use code SAVE20.,L0_Ham,mendeley_financial
Your loan application was approved. Submit documents to receive payment.,S4_LoanJob,mendeley_financial
Your food delivery has arrived. Please collect it.,L0_Ham,mendeley_financial
Claim your prize money worth BDT 5000 by sending your bank details now.,S3_LotteryPrize,mendeley_financial
"You are selected for government subsidy. Verify details to claim BDT 15,000.",S5_Impersonation,mendeley_financial
Congratulations! You won a free trip. Reply YES to claim your prize.,S2_FakePromo,mendeley_financial
Your mobile data has been recharged with 2GB. Enjoy surfing.,L0_Ham,mendeley_financial
Your food order from FoodieApp is delivered. Enjoy your meal!,L0_Ham,mendeley_financial
Limited-time offer! Double your investment in <DATE_TIME>. Call now.,S2_FakePromo,mendeley_financial
You have successfully booked a taxi for <DATE_TIME>.,L0_Ham,mendeley_financial
"Final notice! Claim your BDT 10,000 insurance payout <DATE_TIME>.",L0_Ham,mendeley_financial
Your <DATE_TIME> gym subscription has been renewed. Thank you.,L0_Ham,mendeley_financial
You have unpaid fines totaling BDT 1200. Pay now to avoid penalties.,L0_Ham,mendeley_financial
Event reminder: Music concert <DATE_TIME> at <DATE_TIME> at City Arena.,L0_Ham,mendeley_financial
Your debit card has been temporarily blocked for security reasons.,S1_AccountCompromise,mendeley_financial
Your parcel #<US_DRIVER_LICENSE> is ready for pickup at the post office.,L0_Ham,mendeley_financial
Urgent: Your loan approval is pending. Submit documents to proceed.,S4_LoanJob,mendeley_financial
"Get rich quick! Invest BDT 20,000 in crypto mining and earn huge profits.",S4_LoanJob,mendeley_financial
Your electricity meter reading is due. Please pay your bill of BDT 2500.,L0_Ham,mendeley_financial
Last chance: Claim your cashback by verifying your account details now.,S1_AccountCompromise,mendeley_financial
Congratulations! You are selected for a free smartphone giveaway. Reply YES.,S2_FakePromo,mendeley_financial
Double your money with our new investment plan. Call us <DATE_TIME>,S4_LoanJob,mendeley_financial
Urgent! Verify your bank details to prevent account suspension.,S1_AccountCompromise,mendeley_financial
"Claim your prize worth BDT 10,000 by replying",S3_LotteryPrize,mendeley_financial
Your recent payment of BDT 1500 was successful,L0_Ham,mendeley_financial
Your parcel #<US_DRIVER_LICENSE> is out for delivery.,L0_Ham,mendeley_financial
Your electricity bill of BDT 800 is due <DATE_TIME>.,L0_Ham,mendeley_financial
"Immediate notice: Unauthorized transaction detected, act now!",L0_Ham,mendeley_financial
You have won a free luxury watch. Reply to claim now.,S2_FakePromo,mendeley_financial
Your mobile recharge of BDT 300 was successful.,L0_Ham,mendeley_financial
Thank you for your recent bank deposit of BDT 5000.,L0_Ham,mendeley_financial
"Claim your government grant of BDT 12,000 now.",S5_Impersonation,mendeley_financial
You have a new message from the lottery office. Claim winnings.,L0_Ham,mendeley_financial
Your credit card has been temporarily blocked. Confirm details.,S1_AccountCompromise,mendeley_financial
Congratulations! You are selected for exclusive cashback offer.,S2_FakePromo,mendeley_financial
Your order #5678 has been processed and shipped.,L0_Ham,mendeley_financial
Your electricity bill payment of BDT 3200 was successful.,L0_Ham,mendeley_financial
Reminder: Doctor appointment scheduled for <DATE_TIME> at <DATE_TIME>.,L0_Ham,mendeley_financial
"Claim your cash reward of BDT 10,000 now. Send your bank details to proceed.",S2_FakePromo,mendeley_financial
Your Uber ride has been confirmed for <DATE_TIME>.,L0_Ham,mendeley_financial
Congratulations! You have been pre-approved for a loan. Apply now to get instant approval.,S4_LoanJob,mendeley_financial
Your recent grocery order #78345 has been delivered. Enjoy your purchase!,L0_Ham,mendeley_financial
Your Netflix subscription has been renewed. Thank you for staying with us.,L0_Ham,mendeley_financial
Alert: Unrecognized login attempt detected on your email. Secure your account now.,S1_AccountCompromise,mendeley_financial
Please verify your social security number to claim your government grant.,S5_Impersonation,mendeley_financial
Your cab driver is on the way and will arrive in <DATE_TIME>.,L0_Ham,mendeley_financial
Let's meet at the cafe <DATE_TIME>?,L0_Ham,mendeley_financial
আপনার বিকাশে 350 টাকা জিতেছেন! তথ্য নিশ্চিত করতে এখনই লিঙ্কে যান।,S3_LotteryPrize,mendeley_financial
Congratulations! You won a free iPhone. Claim now at <URL>,S6_PhishingLink,mendeley_financial
Don't forget to bring the documents for <DATE_TIME>'s meeting,L0_Ham,mendeley_financial
আপনার নাম্বারটি নির্বাচিত হয়েছে লটারি জেতার জন্য। লিঙ্কে যাচাই করুন।,S3_LotteryPrize,mendeley_financial
Can you send me your notes for <DATE_TIME>'s class?,L0_Ham,mendeley_financial
"Congratulations! You have won a BDT 20,000 shopping voucher. Reply to claim your prize.",S1_AccountCompromise,mendeley_financial
Your parcel #<US_DRIVER_LICENSE> will be delivered <DATE_TIME>. Track live through our app,L0_Ham,mendeley_financial
Reminder: Your flight booking to <LOCATION> is scheduled for <DATE_TIME> at <DATE_TIME>.,L0_Ham,mendeley_financial
Important: Your bank account is locked due to suspicious activity. Verify your identity now.,S1_AccountCompromise,mendeley_financial
"Claim instant loan approval up to BDT 50,000. Send your documents to proceed.",S4_LoanJob,mendeley_financial
Your hotel booking confirmation #12345 for <DATE_TIME> in <LOCATION>.,L0_Ham,mendeley_financial
Payment of BDT 3800 received. Thank you for your payment to ABC Store,L0_Ham,mendeley_financial
Final notice: Update your billing info or your mobile service will be suspended.,L0_Ham,mendeley_financial
Your subscription to Sports Daily renewed successfully. Enjoy your exclusive content!,L0_Ham,mendeley_financial
Alert: Suspicious login attempt on your email account. Secure it immediately.,S1_AccountCompromise,mendeley_financial
You’ve earned BDT 1500 cashback on your last grocery purchase.,L0_Ham,mendeley_financial
"Your taxi will arrive in <DATE_TIME>. Driver: Saiful, Car: Blue Toyota.",L0_Ham,mendeley_financial
"অভিনন্দন! আপনি ২০,০০০ টাকার ভাউচার জিতেছেন। আপনার <PERSON> পেতে “YES” রিপ্লাই করুন।",S3_LotteryPrize,mendeley_financial
"Your bank transfer of BDT 10,000 has been successfully processed",L0_Ham,mendeley_financial
You’ve won a free entry to the VIP concert! Reply YES to claim your tickets.,S2_FakePromo,mendeley_financial
Warning: Multiple failed login attempts on your social media account. Check activity now.,S1_AccountCompromise,mendeley_financial
"Your insurance claim was approved. BDT 15,000 will be credited to your account shortly.",L0_Ham,mendeley_financial
Your flight to <LOCATION> is on schedule for <DATE_TIME>. Have a safe trip!,L0_Ham,mendeley_financial
Confirm your bank details now to avoid loan application cancellation.,S4_LoanJob,mendeley_financial
Your electricity bill for <DATE_TIME> is BDT 2900. Please pay by the due date.,L0_Ham,mendeley_financial
Congratulations! You have been selected to get an exclusive reward! Your name came up for a YETI War Survival Kit. This special gift is from Tractor Supply. Hurry up! Your Reward is Ready,S2_FakePromo,mendeley_financial
Your cloud storage is full. Please take action to free up space. Cloud Storage – Storage Limit Reached Your storage reached 100%,S2_FakePromo,mendeley_financial
ANSWER FOR FREE!You have been chosen to participate in our Loyalty Program for FREE! It will take you <DATE_TIME> to receive this fantastic prize.,S2_FakePromo,mendeley_financial
Get a free Amazon voucher by completing this survey now.,S2_FakePromo,mendeley_financial
Congratulations! Your subscription is upgraded. Click to confirm,S6_PhishingLink,mendeley_financial
Bank Alert: Your account will be locked due to pending verification.,L0_Ham,mendeley_financial
"<PERSON>, I sent you 1500 taka via bKash. Check and confirm",L0_Ham,mendeley_financial
Congratulations! You have been selected for a $5000 government loan with 0% interest. Apply now!,S5_Impersonation,mendeley_financial
Can you return the 1000 BDT I lent you <DATE_TIME>? Need it urgently,L0_Ham,mendeley_financial
Get 200% return by investing just $100 in our crypto program. Limited seats!,S4_LoanJob,mendeley_financial
Claim your free cashback of $250 <DATE_TIME> by entering your card details,S2_FakePromo,mendeley_financial
Last chance! Clear your loan dues now to avoid legal action,S4_LoanJob,mendeley_financial
"Please approve the 12,500 BDT payment request I sent on Payoneer.",L0_Ham,mendeley_financial
