label,message,feat_char_count,feat_word_count,feat_sentence_count,feat_avg_word_length,feat_contains_bangla,feat_bangla_ratio,feat_contains_english,feat_is_code_mixed,feat_has_url,feat_url_count,feat_has_url_shortener,feat_has_phone,feat_phone_count,feat_urgency_word_count,feat_has_urgency,feat_scam_indicator_count,feat_has_scam_indicator,feat_action_word_count,feat_has_action,feat_exclamation_count,feat_question_count,feat_all_caps_words,feat_digit_count,feat_digit_ratio,feat_mentions_bkash,feat_mentions_nagad,feat_mentions_rocket,feat_mentions_dbbl,feat_mentions_otp,feat_mentions_pin,feat_has_spelling_error,feat_readability_score
scam,Claim your mystery gift by sending a reply with your full name and address.,75,14,1,4.428571428571429,False,0.0,True,False,False,0,False,False,0,0,False,2,True,2,True,0,0,0,0,0.0,False,False,False,False,False,False,False,0
scam,Claim your free mobile upgrade by confirming your account info via SMS.,71,12,1,5.0,False,0.0,True,False,False,0,False,False,0,0,False,2,True,1,True,0,0,1,0,0.0,False,False,False,False,False,False,False,0
scam,You have a new message from the lottery office. Claim your winnings ASAP.,73,13,2,4.6923076923076925,False,0.0,True,False,False,0,False,False,0,1,True,2,True,0,False,0,0,1,0,0.0,False,False,False,False,False,False,False,0
scam,Claim your prize money by paying a small processing fee at the link below,73,14,1,4.285714285714286,False,0.0,True,False,False,0,False,False,0,0,False,2,True,1,True,0,0,0,0,0.0,False,False,False,False,False,False,False,0
scam,"Claim your BDT 15,000 bonus credits from our new app by signing up now.",71,14,1,4.142857142857143,False,0.0,True,False,False,0,False,False,0,1,True,2,True,0,False,0,0,1,5,0.07042253521126761,False,False,False,False,False,False,False,0
scam,Claim your tax refund by uploading your financial documents immediately.,72,10,1,6.3,False,0.0,True,False,False,0,False,False,0,1,True,1,True,0,False,0,0,0,0,0.0,False,False,False,False,False,False,False,0
scam,Claim your exclusive membership rewards by clicking here. Limited time offer!,77,11,2,6.090909090909091,False,0.0,True,False,False,0,False,False,0,1,True,3,True,1,True,1,0,0,0,0.0,False,False,False,False,False,False,False,0
ham,Your BDT 2000 payment has been received. Thank you for using our service.,73,13,2,4.6923076923076925,False,0.0,True,False,False,0,False,False,0,0,False,0,False,1,True,0,0,1,4,0.0547945205479452,False,False,False,False,False,False,False,0
scam,Urgent: Verify your identity to avoid account closure. Click this link now.,75,12,2,5.333333333333333,False,0.0,True,False,False,0,False,False,0,2,True,1,True,2,True,0,0,0,0,0.0,False,False,False,False,False,False,False,0
scam,Congratulations! You have been selected for a free smartwatch. Reply YES.,73,11,3,5.7272727272727275,False,0.0,True,False,False,0,False,False,0,0,False,1,True,1,True,1,0,1,0,0.0,False,False,False,False,False,False,False,0
ham,Your electricity bill of BDT 1500 is due <DATE_TIME>. Please pay on time.,73,13,2,4.6923076923076925,False,0.0,True,False,False,0,False,False,0,0,False,0,False,1,True,0,0,2,4,0.0547945205479452,False,False,False,False,False,False,False,0
scam,Immediate action required! Suspicious login detected. Confirm your password.,76,9,3,7.555555555555555,False,0.0,True,False,False,0,False,False,0,0,False,2,True,1,True,1,0,0,0,0.0,False,False,False,False,False,False,False,0
ham,Your mobile recharge of BDT 500 was successful.,47,8,1,5.0,False,0.0,True,False,False,0,False,False,0,0,False,0,False,0,False,0,0,1,3,0.06382978723404255,False,False,False,False,False,False,False,0
scam,"Last chance to claim your cashback offer worth BDT 10,000!",58,10,1,4.9,False,0.0,True,False,False,0,False,False,0,1,True,3,True,0,False,1,0,1,5,0.08620689655172414,False,False,False,False,False,False,False,0
ham,Package delivered! Track it anytime using tracking number #12345.,65,9,2,6.333333333333333,False,0.0,True,False,False,0,False,False,0,0,False,0,False,0,False,1,0,0,5,0.07692307692307693,False,False,False,False,False,False,False,0
scam,You won an exclusive holiday package. Contact us immediately to claim.,70,11,2,5.454545454545454,False,0.0,True,False,False,0,False,False,0,1,True,2,True,0,False,0,0,0,0,0.0,False,False,False,False,False,False,False,0
ham,Your online subscription has been renewed successfully,54,7,1,6.857142857142857,False,0.0,True,False,False,0,False,False,0,0,False,0,False,0,False,0,0,0,0,0.0,False,False,False,False,False,False,False,0
scam,Warning! Your account has been suspended due to suspicious activity.,68,10,2,5.9,False,0.0,True,False,False,0,False,False,0,0,False,1,True,0,False,1,0,0,0,0.0,False,False,False,False,False,False,False,0
ham,Enjoy 20% discount on your next purchase. Use code SAVE20.,58,10,2,4.9,False,0.0,True,False,False,0,False,False,0,0,False,0,False,0,False,0,0,1,4,0.06896551724137931,False,False,False,False,False,False,False,0
scam,Your loan application was approved. Submit documents to receive payment.,72,10,2,6.3,False,0.0,True,False,False,0,False,False,0,0,False,0,False,1,True,0,0,0,0,0.0,False,False,False,False,False,False,False,0
ham,Thank you for your recent payment of BDT 3000.,46,9,1,4.222222222222222,False,0.0,True,False,False,0,False,False,0,0,False,0,False,1,True,0,0,1,4,0.08695652173913043,False,False,False,False,False,False,False,0
scam,Alert! Unrecognized device logged in to your account. Verify immediately.,73,10,3,6.4,False,0.0,True,False,False,0,False,False,0,1,True,1,True,1,True,1,0,0,0,0.0,False,False,False,False,False,False,False,0
ham,Your food delivery has arrived. Please collect it.,50,8,2,5.375,False,0.0,True,False,False,0,False,False,0,0,False,0,False,0,False,0,0,0,0,0.0,False,False,False,False,False,False,False,0
scam,Claim your prize money worth BDT 5000 by sending your bank details now.,71,13,1,4.538461538461538,False,0.0,True,False,False,0,False,False,0,1,True,2,True,1,True,0,0,1,4,0.056338028169014086,False,False,False,False,False,False,False,0
ham,Your appointment with Dr. <PERSON> has been confirmed for <DATE_TIME>.,70,10,2,6.1,False,0.0,True,False,False,0,False,False,0,0,False,0,False,1,True,0,0,2,0,0.0,False,False,False,False,False,False,False,0
scam,"You are selected for government subsidy. Verify details to claim BDT 15,000.",76,12,2,5.416666666666667,False,0.0,True,False,False,0,False,False,0,0,False,2,True,1,True,0,0,1,5,0.06578947368421052,False,False,False,False,False,False,False,0
ham,Your electricity bill payment of BDT 2600 was successful.,57,9,1,5.444444444444445,False,0.0,True,False,False,0,False,False,0,0,False,0,False,1,True,0,0,1,4,0.07017543859649122,False,False,False,False,False,False,False,0
ham,Your BDT 3000 utility bill has been paid successfully.,54,9,1,5.111111111111111,False,0.0,True,False,False,0,False,False,0,0,False,0,False,0,False,0,0,1,4,0.07407407407407407,False,False,False,False,False,False,False,0
scam,Urgent! Confirm your credit card details to avoid suspension.,61,9,2,5.888888888888889,False,0.0,True,False,False,0,False,False,0,1,True,0,False,1,True,1,0,0,0,0.0,False,False,False,False,False,False,False,0
scam,Congratulations! You won a free trip. Reply YES to claim your prize.,68,12,3,4.75,False,0.0,True,False,False,0,False,False,0,0,False,4,True,1,True,1,0,1,0,0.0,False,False,False,False,False,False,False,0
ham,Your mobile data has been recharged with 2GB. Enjoy surfing.,60,10,2,5.1,False,0.0,True,False,False,0,False,False,0,0,False,0,False,0,False,0,0,1,1,0.016666666666666666,False,False,False,False,False,False,False,0
scam,Warning: Suspicious transaction detected. Verify your identity immediately.,75,8,2,8.5,False,0.0,True,False,False,0,False,False,0,1,True,1,True,1,True,0,0,0,0,0.0,False,False,False,False,False,False,False,0
ham,Your food order from FoodieApp is delivered. Enjoy your meal!,61,10,2,5.2,False,0.0,True,False,False,0,False,False,0,0,False,0,False,0,False,1,0,0,0,0.0,False,False,False,False,False,False,False,0
scam,Limited-time offer! Double your investment in <DATE_TIME>. Call now.,68,9,3,6.666666666666667,False,0.0,True,False,False,0,False,False,0,2,True,1,True,1,True,1,0,1,0,0.0,False,False,False,False,False,False,False,0
ham,You have successfully booked a taxi for <DATE_TIME>.,52,8,1,5.625,False,0.0,True,False,False,0,False,False,0,0,False,0,False,0,False,0,0,1,0,0.0,False,False,False,False,False,False,False,0
scam,"Final notice! Claim your BDT 10,000 insurance payout <DATE_TIME>.",65,9,2,6.333333333333333,False,0.0,True,False,False,0,False,False,0,0,False,1,True,1,True,1,0,2,5,0.07692307692307693,False,False,False,False,False,False,False,0
ham,Your <DATE_TIME> gym subscription has been renewed. Thank you.,62,9,2,6.0,False,0.0,True,False,False,0,False,False,0,0,False,0,False,0,False,0,0,1,0,0.0,False,False,False,False,False,False,False,0
scam,You have unpaid fines totaling BDT 1200. Pay now to avoid penalties.,68,12,2,4.75,False,0.0,True,False,False,0,False,False,0,1,True,0,False,1,True,0,0,1,4,0.058823529411764705,False,False,False,False,False,False,False,0
ham,Event reminder: Music concert <DATE_TIME> at <DATE_TIME> at City Arena.,71,10,1,6.2,False,0.0,True,False,False,0,False,False,0,0,False,0,False,0,False,0,0,2,0,0.0,False,False,False,False,False,False,False,0
scam,Your debit card has been temporarily blocked for security reasons.,66,10,1,5.7,False,0.0,True,False,False,0,False,False,0,0,False,1,True,0,False,0,0,0,0,0.0,False,False,False,False,False,False,False,0
ham,Your parcel #<US_DRIVER_LICENSE> is ready for pickup at the post office.,72,11,1,5.636363636363637,False,0.0,True,False,False,0,False,False,0,0,False,0,False,0,False,0,0,1,0,0.0,False,False,False,False,False,False,False,0
scam,Urgent: Your loan approval is pending. Submit documents to proceed.,67,10,2,5.8,False,0.0,True,False,False,0,False,False,0,1,True,0,False,0,False,0,0,0,0,0.0,False,False,False,False,False,False,False,0
ham,Your cab driver will arrive in <DATE_TIME>. Please be ready,59,10,2,5.0,False,0.0,True,False,False,0,False,False,0,0,False,0,False,0,False,0,0,1,0,0.0,False,False,False,False,False,False,False,0
scam,"Get rich quick! Invest BDT 20,000 in crypto mining and earn huge profits.",73,13,2,4.6923076923076925,False,0.0,True,False,False,0,False,False,0,1,True,0,False,0,False,1,0,1,5,0.0684931506849315,False,False,False,False,False,False,False,0
ham,Thank you for registering for the webinar. We will email the link soon.,71,13,2,4.538461538461538,False,0.0,True,False,False,0,False,False,0,0,False,0,False,1,True,0,0,0,0,0.0,False,False,False,False,False,False,False,0
ham,Your electricity meter reading is due. Please pay your bill of BDT 2500.,72,13,2,4.615384615384615,False,0.0,True,False,False,0,False,False,0,0,False,0,False,1,True,0,0,1,4,0.05555555555555555,False,False,False,False,False,False,False,0
scam,Last chance: Claim your cashback by verifying your account details now.,71,11,1,5.545454545454546,False,0.0,True,False,False,0,False,False,0,2,True,3,True,1,True,0,0,0,0,0.0,False,False,False,False,False,False,False,0
scam,Your BDT 4000 electricity bill has been paid. Thank you for your payment.,73,13,2,4.6923076923076925,False,0.0,True,False,False,0,False,False,0,0,False,0,False,1,True,0,0,1,4,0.0547945205479452,False,False,False,False,False,False,False,0
ham,Alert: Suspicious account activity detected. Verify your info immediately.,74,9,2,7.333333333333333,False,0.0,True,False,False,0,False,False,0,1,True,1,True,1,True,0,0,0,0,0.0,False,False,False,False,False,False,False,0
scam,Congratulations! You are selected for a free smartphone giveaway. Reply YES.,76,11,3,6.0,False,0.0,True,False,False,0,False,False,0,0,False,1,True,1,True,1,0,1,0,0.0,False,False,False,False,False,False,False,0
ham,Your <DATE_TIME> mobile recharge of BDT 600 was successful.,59,9,1,5.666666666666667,False,0.0,True,False,False,0,False,False,0,0,False,0,False,0,False,0,0,2,3,0.05084745762711865,False,False,False,False,False,False,False,0
scam,Urgent! Your login was from an unknown device. Confirm your identity now.,73,12,3,5.166666666666667,False,0.0,True,False,False,0,False,False,0,2,True,1,True,1,True,1,0,0,0,0.0,False,False,False,False,False,False,False,0
ham,Your food delivery order has arrived. Enjoy your meal!,54,9,2,5.111111111111111,False,0.0,True,False,False,0,False,False,0,0,False,0,False,0,False,1,0,0,0,0.0,False,False,False,False,False,False,False,0
scam,Double your money with our new investment plan. Call us <DATE_TIME>,67,11,2,5.181818181818182,False,0.0,True,False,False,0,False,False,0,0,False,0,False,1,True,0,0,1,0,0.0,False,False,False,False,False,False,False,0
scam,Urgent! Verify your bank details to prevent account suspension.,63,9,2,6.111111111111111,False,0.0,True,False,False,0,False,False,0,1,True,1,True,1,True,1,0,0,0,0.0,False,False,False,False,False,False,False,0
scam,"Claim your prize worth BDT 10,000 by replying",45,8,1,4.75,False,0.0,True,False,False,0,False,False,0,0,False,2,True,1,True,0,0,1,5,0.1111111111111111,False,False,False,False,False,False,False,0
ham,Your recent payment of BDT 1500 was successful,46,8,1,4.875,False,0.0,True,False,False,0,False,False,0,0,False,0,False,1,True,0,0,1,4,0.08695652173913043,False,False,False,False,False,False,False,0
ham,Your parcel #<US_DRIVER_LICENSE> is out for delivery.,53,7,1,6.714285714285714,False,0.0,True,False,False,0,False,False,0,0,False,0,False,0,False,0,0,1,0,0.0,False,False,False,False,False,False,False,0
ham,Your electricity bill of BDT 800 is due <DATE_TIME>.,52,9,1,4.888888888888889,False,0.0,True,False,False,0,False,False,0,0,False,0,False,0,False,0,0,2,3,0.057692307692307696,False,False,False,False,False,False,False,0
scam,"Immediate notice: Unauthorized transaction detected, act now!",61,7,1,7.857142857142857,False,0.0,True,False,False,0,False,False,0,2,True,0,False,0,False,1,0,0,0,0.0,False,False,False,False,False,False,False,0
scam,You have won a free luxury watch. Reply to claim now.,53,11,2,3.909090909090909,False,0.0,True,False,False,0,False,False,0,1,True,3,True,1,True,0,0,0,0,0.0,False,False,False,False,False,False,False,0
ham,Your mobile recharge of BDT 300 was successful.,47,8,1,5.0,False,0.0,True,False,False,0,False,False,0,0,False,0,False,0,False,0,0,1,3,0.06382978723404255,False,False,False,False,False,False,False,0
ham,Reminder: Doctor’s appointment <DATE_TIME> at <DATE_TIME>,57,6,1,8.666666666666666,False,0.0,True,False,False,0,False,False,0,0,False,0,False,0,False,0,0,2,0,0.0,False,False,False,False,False,False,False,0
ham,Thank you for your recent bank deposit of BDT 5000.,51,10,1,4.2,False,0.0,True,False,False,0,False,False,0,0,False,0,False,0,False,0,0,1,4,0.0784313725490196,False,False,False,False,False,False,False,0
scam,"Claim your government grant of BDT 12,000 now.",46,8,1,4.875,False,0.0,True,False,False,0,False,False,0,1,True,1,True,0,False,0,0,1,5,0.10869565217391304,False,False,False,False,False,False,False,0
scam,"Alert! Suspicious login attempt detected, verify your account.",62,8,2,6.875,False,0.0,True,False,False,0,False,False,0,0,False,2,True,1,True,1,0,0,0,0.0,False,False,False,False,False,False,False,0
ham,Your cab driver will arrive in <DATE_TIME>.,43,7,1,5.285714285714286,False,0.0,True,False,False,0,False,False,0,0,False,0,False,0,False,0,0,1,0,0.0,False,False,False,False,False,False,False,0
ham,Your online subscription has been renewed. Thank you!,53,8,2,5.75,False,0.0,True,False,False,0,False,False,0,0,False,0,False,0,False,1,0,0,0,0.0,False,False,False,False,False,False,False,0
ham,You have a new message from the lottery office. Claim winnings.,63,11,2,4.818181818181818,False,0.0,True,False,False,0,False,False,0,0,False,2,True,0,False,0,0,0,0,0.0,False,False,False,False,False,False,False,0
scam,Your credit card has been temporarily blocked. Confirm details.,63,9,2,6.111111111111111,False,0.0,True,False,False,0,False,False,0,0,False,1,True,1,True,0,0,0,0,0.0,False,False,False,False,False,False,False,0
scam,Congratulations! You are selected for exclusive cashback offer.,63,8,2,7.0,False,0.0,True,False,False,0,False,False,0,0,False,2,True,0,False,1,0,0,0,0.0,False,False,False,False,False,False,False,0
ham,Your electricity payment of BDT 2200 was successful.,52,8,1,5.625,False,0.0,True,False,False,0,False,False,0,0,False,0,False,1,True,0,0,1,4,0.07692307692307693,False,False,False,False,False,False,False,0
ham,Your order #5678 has been processed and shipped.,48,8,1,5.125,False,0.0,True,False,False,0,False,False,0,0,False,0,False,0,False,0,0,0,4,0.08333333333333333,False,False,False,False,False,False,False,0
ham,Payment reminder: Your internet bill of BDT 1200 is due.,56,10,1,4.7,False,0.0,True,False,False,0,False,False,0,0,False,0,False,1,True,0,0,1,4,0.07142857142857142,False,False,False,False,False,False,False,0
scam,Alert: Suspicious debit card transaction of BDT 5000 detected. Verify immediately.,82,11,2,6.545454545454546,False,0.0,True,False,False,0,False,False,0,1,True,1,True,1,True,0,0,1,4,0.04878048780487805,False,False,False,False,False,False,False,0
scam,You won a free vacation to the <LOCATION>! Reply YES to claim your prize.,73,14,2,4.285714285714286,False,0.0,True,False,False,0,False,False,0,0,False,4,True,1,True,1,0,2,0,0.0,False,False,False,False,False,False,False,0
ham,Your electricity bill payment of BDT 3200 was successful.,57,9,1,5.444444444444445,False,0.0,True,False,False,0,False,False,0,0,False,0,False,1,True,0,0,1,4,0.07017543859649122,False,False,False,False,False,False,False,0
ham,Your package #<US_DRIVER_LICENSE> is out for delivery. Track it using our app.,78,12,2,5.583333333333333,False,0.0,True,False,False,0,False,False,0,0,False,0,False,0,False,0,0,1,0,0.0,False,False,False,False,False,False,False,0
ham,Reminder: Doctor appointment scheduled for <DATE_TIME> at <DATE_TIME>.,70,8,1,7.875,False,0.0,True,False,False,0,False,False,0,0,False,0,False,0,False,0,0,2,0,0.0,False,False,False,False,False,False,False,0
scam,Urgent: Your bank account has been locked due to suspicious activity. Verify now.,81,13,2,5.3076923076923075,False,0.0,True,False,False,0,False,False,0,2,True,1,True,1,True,0,0,0,0,0.0,False,False,False,False,False,False,False,0
scam,"Claim your cash reward of BDT 10,000 now. Send your bank details to proceed.",76,14,2,4.5,False,0.0,True,False,False,0,False,False,0,1,True,2,True,1,True,0,0,1,5,0.06578947368421052,False,False,False,False,False,False,False,0
ham,Your mobile recharge of BDT 300 was successful.,47,8,1,5.0,False,0.0,True,False,False,0,False,False,0,0,False,0,False,0,False,0,0,1,3,0.06382978723404255,False,False,False,False,False,False,False,0
ham,Your Uber ride has been confirmed for <DATE_TIME>.,50,8,1,5.375,False,0.0,True,False,False,0,False,False,0,0,False,0,False,1,True,0,0,1,0,0.0,False,False,False,False,False,False,False,0
ham,Payment of BDT 5000 received. Thank you for your timely payment.,64,11,2,4.909090909090909,False,0.0,True,False,False,0,False,False,0,0,False,0,False,1,True,0,0,1,4,0.0625,False,False,False,False,False,False,False,0
scam,Last chance to update your payment info or your subscription will be suspended.,79,13,1,5.153846153846154,False,0.0,True,False,False,0,False,False,0,1,True,1,True,2,True,0,0,0,0,0.0,False,False,False,False,False,False,False,0
scam,Congratulations! You have been pre-approved for a loan. Apply now to get instant approval.,90,14,3,5.5,False,0.0,True,False,False,0,False,False,0,2,True,0,False,0,False,1,0,0,0,0.0,False,False,False,False,False,False,False,0
ham,Your recent grocery order #78345 has been delivered. Enjoy your purchase!,73,11,2,5.7272727272727275,False,0.0,True,False,False,0,False,False,0,0,False,0,False,0,False,1,0,0,5,0.0684931506849315,False,False,False,False,False,False,False,0
ham,Your Netflix subscription has been renewed. Thank you for staying with us.,74,12,2,5.25,False,0.0,True,False,False,0,False,False,0,0,False,0,False,0,False,0,0,0,0,0.0,False,False,False,False,False,False,False,0
scam,Alert: Unrecognized login attempt detected on your email. Secure your account now.,82,12,2,5.916666666666667,False,0.0,True,False,False,0,False,False,0,1,True,1,True,0,False,0,0,0,0,0.0,False,False,False,False,False,False,False,0
ham,"You've received BDT 1,000 cashback from your last purchase",58,9,1,5.555555555555555,False,0.0,True,False,False,0,False,False,0,0,False,1,True,0,False,0,0,1,4,0.06896551724137931,False,False,False,False,False,False,False,0
scam,Please verify your social security number to claim your government grant.,73,11,1,5.7272727272727275,False,0.0,True,False,False,0,False,False,0,0,False,2,True,1,True,0,0,0,0,0.0,False,False,False,False,False,False,False,0
ham,Your cab driver is on the way and will arrive in <DATE_TIME>.,61,12,1,4.166666666666667,False,0.0,True,False,False,0,False,False,0,0,False,0,False,0,False,0,0,1,0,0.0,False,False,False,False,False,False,False,0
scam,Verify your Apple ID to prevent permanent lockout. Ignore if you did not request.,81,14,2,4.857142857142857,False,0.0,True,False,False,0,False,False,0,0,False,1,True,1,True,0,0,1,0,0.0,False,False,False,False,False,False,False,0
ham,Thank you for your donation of BDT 500. Your generosity is appreciated.,71,12,2,5.0,False,0.0,True,False,False,0,False,False,0,0,False,0,False,0,False,0,0,1,3,0.04225352112676056,False,False,False,False,False,False,False,0
ham,Let's meet at the cafe <DATE_TIME>?,35,6,1,5.0,False,0.0,True,False,False,0,False,False,0,0,False,0,False,0,False,0,1,1,0,0.0,False,False,False,False,False,False,False,0
scam,Claim your cashback reward #10 now! Limited time offer.,55,9,2,5.222222222222222,False,0.0,True,False,False,0,False,False,0,2,True,4,True,0,False,1,0,0,2,0.03636363636363636,False,False,False,False,False,False,False,0
scam,আপনার বিকাশে 350 টাকা জিতেছেন! তথ্য নিশ্চিত করতে এখনই লিঙ্কে যান।,65,11,2,5.0,True,1.5625,False,False,False,0,False,False,0,0,False,0,False,0,False,1,0,0,3,0.046153846153846156,True,False,False,False,False,False,False,0
scam,Congratulations! You won a free iPhone. Claim now at <URL>,58,10,3,4.9,False,0.0,True,False,False,0,False,False,0,1,True,3,True,0,False,1,0,1,0,0.0,False,False,False,False,False,False,False,0
ham,Don't forget to bring the documents for <DATE_TIME>'s meeting,61,9,1,5.888888888888889,False,0.0,True,False,False,0,False,False,0,0,False,0,False,0,False,0,0,0,0,0.0,False,False,False,False,False,False,False,0
scam,Limited offer! Get 50% cashback on your next payment. Click here,64,11,3,4.909090909090909,False,0.0,True,False,False,0,False,False,0,1,True,3,True,2,True,1,0,0,2,0.03125,False,False,False,False,False,False,False,0
scam,আপনার নাম্বারটি নির্বাচিত হয়েছে লটারি জেতার জন্য। লিঙ্কে যাচাই করুন।,69,10,2,6.0,True,1.6571428571428573,False,False,False,0,False,False,0,0,False,0,False,0,False,0,0,0,0,0.0,False,False,False,False,False,False,False,0
ham,Can you send me your notes for <DATE_TIME>'s class?,51,9,1,4.777777777777778,False,0.0,True,False,False,0,False,False,0,0,False,0,False,1,True,0,1,0,0,0.0,False,False,False,False,False,False,False,0
scam,Win ₹5000 instantly! Verify your account at <URL>,49,8,2,5.25,False,0.0,True,False,False,0,False,False,0,1,True,1,True,1,True,1,0,1,4,0.08163265306122448,False,False,False,False,False,False,False,0
scam,Alert: Unusual withdrawal of BDT 4500 from your account. Verify now to avoid loss.,82,14,2,4.928571428571429,False,0.0,True,False,False,0,False,False,0,1,True,1,True,1,True,0,0,1,4,0.04878048780487805,False,False,False,False,False,False,False,0
scam,"Congratulations! You have won a BDT 20,000 shopping voucher. Reply to claim your prize.",87,14,3,5.285714285714286,False,0.0,True,False,False,0,False,False,0,0,False,4,True,1,True,1,0,1,5,0.05747126436781609,False,False,False,False,False,True,False,0
ham,Your water bill of BDT 1200 has been paid successfully.,55,10,1,4.6,False,0.0,True,False,False,0,False,False,0,0,False,0,False,0,False,0,0,1,4,0.07272727272727272,False,False,False,False,False,False,False,0
ham,Your parcel #<US_DRIVER_LICENSE> will be delivered <DATE_TIME>. Track live through our app,90,12,2,6.583333333333333,False,0.0,True,False,False,0,False,False,0,0,False,0,False,0,False,0,0,2,0,0.0,False,False,False,False,False,False,False,0
ham,Reminder: Your flight booking to <LOCATION> is scheduled for <DATE_TIME> at <DATE_TIME>.,88,12,1,6.416666666666667,False,0.0,True,False,False,0,False,False,0,0,False,0,False,0,False,0,0,3,0,0.0,False,False,False,False,False,False,False,0
scam,Important: Your bank account is locked due to suspicious activity. Verify your identity now.,92,14,2,5.642857142857143,False,0.0,True,False,False,0,False,False,0,1,True,1,True,1,True,0,0,0,0,0.0,False,False,False,False,False,False,False,0
scam,"Claim instant loan approval up to BDT 50,000. Send your documents to proceed.",77,13,2,5.0,False,0.0,True,False,False,0,False,False,0,1,True,1,True,1,True,0,0,1,5,0.06493506493506493,False,False,False,False,False,False,False,0
ham,Your mobile recharge of BDT 350 was processed successfully.,59,9,1,5.666666666666667,False,0.0,True,False,False,0,False,False,0,0,False,0,False,0,False,0,0,1,3,0.05084745762711865,False,False,False,False,False,False,False,0
ham,Your hotel booking confirmation #12345 for <DATE_TIME> in <LOCATION>.,69,9,1,6.777777777777778,False,0.0,True,False,False,0,False,False,0,0,False,0,False,1,True,0,0,2,5,0.07246376811594203,False,False,False,False,False,False,False,0
ham,Payment of BDT 3800 received. Thank you for your payment to ABC Store,69,13,2,4.384615384615385,False,0.0,True,False,False,0,False,False,0,0,False,0,False,1,True,0,0,2,4,0.057971014492753624,False,False,False,False,False,False,False,0
scam,Final notice: Update your billing info or your mobile service will be suspended.,80,13,1,5.230769230769231,False,0.0,True,False,False,0,False,False,0,0,False,1,True,1,True,0,0,0,0,0.0,False,False,False,False,False,False,False,0
