label,message,feat_char_count,feat_word_count,feat_sentence_count,feat_avg_word_length,feat_contains_bangla,feat_bangla_ratio,feat_contains_english,feat_is_code_mixed,feat_has_url,feat_url_count,feat_has_url_shortener,feat_has_phone,feat_phone_count,feat_urgency_word_count,feat_has_urgency,feat_scam_indicator_count,feat_has_scam_indicator,feat_action_word_count,feat_has_action,feat_exclamation_count,feat_question_count,feat_all_caps_words,feat_digit_count,feat_digit_ratio,feat_mentions_bkash,feat_mentions_nagad,feat_mentions_rocket,feat_mentions_dbbl,feat_mentions_otp,feat_mentions_pin,feat_has_spelling_error,feat_readability_score
scam,Congratulations! You’re pre-qualified for a credit card with a $5000 limit. Apply now.,86,13,3,5.6923076923076925,False,0.0,True,False,False,0,False,False,0,1,True,0,False,0,False,1,0,0,4,0.046511627906976744,False,False,False,False,False,False,False,0
ham,Your online shopping order #78654 is confirmed and will be delivered soon.,74,12,1,5.25,False,0.0,True,False,False,0,False,False,0,0,False,1,True,1,True,0,0,0,5,0.06756756756756757,False,False,False,False,False,True,False,0
ham,Your subscription to Sports Daily renewed successfully. Enjoy your exclusive content!,85,11,2,6.818181818181818,False,0.0,True,False,False,0,False,False,0,0,False,0,False,0,False,1,0,0,0,0.0,False,False,False,False,False,False,False,0
scam,Alert: Suspicious login attempt on your email account. Secure it immediately.,77,11,2,6.090909090909091,False,0.0,True,False,False,0,False,False,0,1,True,1,True,0,False,0,0,0,0,0.0,False,False,False,False,False,False,False,0
ham,You’ve earned BDT 1500 cashback on your last grocery purchase.,62,10,1,5.3,False,0.0,True,False,False,0,False,False,0,0,False,1,True,0,False,0,0,1,4,0.06451612903225806,False,False,False,False,False,False,False,0
scam,"Claim your government relief fund of BDT 30,000. Submit your documents <DATE_TIME>.",83,12,2,6.0,False,0.0,True,False,False,0,False,False,0,0,False,1,True,0,False,0,0,2,5,0.060240963855421686,False,False,False,False,False,False,False,0
ham,"Your taxi will arrive in <DATE_TIME>. Driver: Saiful, Car: Blue Toyota.",71,11,2,5.545454545454546,False,0.0,True,False,False,0,False,False,0,0,False,0,False,0,False,0,0,1,0,0.0,False,False,False,False,False,False,False,0
scam,Your Apple ID has been temporarily disabled. Verify now to avoid permanent lockout,82,13,2,5.384615384615385,False,0.0,True,False,False,0,False,False,0,1,True,1,True,1,True,0,0,1,0,0.0,False,False,False,False,False,False,False,0
ham,Thank you for your charitable donation of BDT 1000. Your kindness is appreciated.,81,13,2,5.3076923076923075,False,0.0,True,False,False,0,False,False,0,0,False,0,False,0,False,0,0,1,4,0.04938271604938271,False,False,False,False,False,False,False,0
scam,Urgent payment required: Your credit card bill of BDT 7000 is overdue. Pay now to avoid fees,92,17,2,4.470588235294118,False,0.0,True,False,False,0,False,False,0,2,True,0,False,1,True,0,0,1,4,0.043478260869565216,False,False,False,False,False,False,False,0
scam,"অভিনন্দন! আপনি ২০,০০০ টাকার ভাউচার জিতেছেন। আপনার <PERSON> পেতে “YES” রিপ্লাই করুন।",83,12,3,6.0,True,1.3095238095238095,True,True,False,0,False,False,0,0,False,0,False,0,False,1,0,2,5,0.060240963855421686,False,False,False,False,False,False,False,0
ham,আপনার বিদ্যুতের বিল ৩১৫০ টাকা সফলভাবে পরিশোধ হয়েছে। ধন্যবাদ।,60,9,2,5.777777777777778,True,1.6666666666666667,False,False,False,0,False,False,0,0,False,0,False,0,False,0,0,0,4,0.06666666666666667,False,False,False,False,False,False,False,0
ham,আপনার প্যাকেজ #এসটি১২৩৪৪ আজ <LOCATION> হবে। ট্র্যাক করতে আমাদের অ্যাপ ব্যবহার করুন।,83,12,2,6.0,True,1.3111111111111111,True,True,False,0,False,False,0,0,False,0,False,0,False,0,0,1,5,0.060240963855421686,False,False,False,False,False,False,False,0
ham,"Your bank transfer of BDT 10,000 has been successfully processed",64,10,1,5.5,False,0.0,True,False,False,0,False,False,0,0,False,0,False,1,True,0,0,1,5,0.078125,False,False,False,False,False,False,False,0
scam,You’ve won a free entry to the VIP concert! Reply YES to claim your tickets.,76,15,2,4.133333333333334,False,0.0,True,False,False,0,False,False,0,0,False,3,True,1,True,1,0,2,0,0.0,False,False,False,False,False,False,False,0
ham,Your parcel #<US_DRIVER_LICENSE> was successfully delivered. Thank you for shopping with us.,92,12,2,6.75,False,0.0,True,False,False,0,False,False,0,0,False,1,True,0,False,0,0,1,0,0.0,False,False,False,False,False,True,False,0
scam,Warning: Multiple failed login attempts on your social media account. Check activity now.,89,13,2,5.923076923076923,False,0.0,True,False,False,0,False,False,0,1,True,1,True,0,False,0,0,0,0,0.0,False,False,False,False,False,False,False,0
ham,"Your insurance claim was approved. BDT 15,000 will be credited to your account shortly.",87,14,2,5.285714285714286,False,0.0,True,False,False,0,False,False,0,0,False,1,True,0,False,0,0,1,5,0.05747126436781609,False,False,False,False,False,False,False,0
scam,"Last chance to claim your cashback offer worth BDT 5,000. Verify now.",69,12,2,4.833333333333333,False,0.0,True,False,False,0,False,False,0,2,True,4,True,1,True,0,0,1,4,0.057971014492753624,False,False,False,False,False,False,False,0
ham,Your flight to <LOCATION> is on schedule for <DATE_TIME>. Have a safe trip!,75,13,2,4.846153846153846,False,0.0,True,False,False,0,False,False,0,0,False,0,False,0,False,1,0,2,0,0.0,False,False,False,False,False,False,False,0
scam,Confirm your bank details now to avoid loan application cancellation.,69,10,1,6.0,False,0.0,True,False,False,0,False,False,0,1,True,0,False,1,True,0,0,0,0,0.0,False,False,False,False,False,False,False,0
ham,Your electricity bill for <DATE_TIME> is BDT 2900. Please pay by the due date.,78,14,2,4.642857142857143,False,0.0,True,False,False,0,False,False,0,0,False,0,False,1,True,0,0,2,4,0.05128205128205128,False,False,False,False,False,False,False,0
scam,Congratulations! You have been selected to get an exclusive reward! Your name came up for a YETI War Survival Kit. This special gift is from Tractor Supply. Hurry up! Your Reward is Ready,187,33,6,4.696969696969697,False,0.0,True,False,False,0,False,False,0,1,True,2,True,0,False,3,0,1,0,0.0,False,False,False,False,False,False,False,0
scam,Enjoy <DATE_TIME> Fee Waiver on Your Medical Quota Debit Card for Safe and Convenient Payment Abroad!,101,16,1,5.375,False,0.0,True,False,False,0,False,False,0,0,False,0,False,1,True,1,0,1,0,0.0,False,False,False,False,False,False,False,0
scam,Your cloud storage is full. Please take action to free up space. Cloud Storage – Storage Limit Reached Your storage reached 100%,128,22,3,4.863636363636363,False,0.0,True,False,False,0,False,False,0,0,False,1,True,0,False,0,0,0,3,0.0234375,False,False,False,False,False,False,False,0
scam,ANSWER FOR FREE!You have been chosen to participate in our Loyalty Program for FREE! It will take you <DATE_TIME> to receive this fantastic prize.,146,24,3,5.125,False,0.0,True,False,False,0,False,False,0,0,False,2,True,0,False,2,0,4,0,0.0,False,False,False,False,False,False,False,0
scam,Get a free Amazon voucher by completing this survey now.,56,10,1,4.7,False,0.0,True,False,False,0,False,False,0,1,True,1,True,0,False,0,0,0,0,0.0,False,False,False,False,False,False,False,0
scam,Congratulations! Your subscription is upgraded. Click to confirm,64,8,3,7.125,False,0.0,True,False,False,0,False,False,0,0,False,0,False,2,True,1,0,0,0,0.0,False,False,False,False,False,False,False,0
scam,Alert: Suspicious activity detected in your PayPal account. Verify now,70,10,2,6.1,False,0.0,True,False,False,0,False,False,0,1,True,1,True,2,True,0,0,0,0,0.0,False,False,False,False,False,False,False,0
scam,bKash: You received 2000 BDT. Click here to confirm your account,64,11,2,4.909090909090909,False,0.0,True,False,False,0,False,False,0,0,False,1,True,2,True,0,0,1,4,0.0625,True,False,False,False,False,False,False,0
ham,Do you want to join the study group <DATE_TIME>?,48,9,1,4.444444444444445,False,0.0,True,False,False,0,False,False,0,0,False,0,False,0,False,0,1,1,0,0.0,False,False,False,False,False,False,False,0
scam,Bank Alert: Your account will be locked due to pending verification.,68,11,1,5.2727272727272725,False,0.0,True,False,False,0,False,False,0,0,False,0,False,0,False,0,0,0,0,0.0,False,False,False,False,False,False,False,0
scam,Earn $100 per day from home with this financial program. Apply now!,67,12,2,4.666666666666667,False,0.0,True,False,False,0,False,False,0,1,True,0,False,0,False,1,0,0,3,0.04477611940298507,False,False,False,False,False,False,False,0
ham,"<PERSON>, I sent you 1500 taka via bKash. Check and confirm",59,11,2,4.454545454545454,False,0.0,True,False,False,0,False,False,0,0,False,0,False,1,True,0,0,1,4,0.06779661016949153,True,False,False,False,False,False,False,0
scam,Congratulations! You have been selected for a $5000 government loan with 0% interest. Apply now!,96,15,3,5.466666666666667,False,0.0,True,False,False,0,False,False,0,1,True,0,False,0,False,2,0,0,5,0.052083333333333336,False,False,False,False,False,False,False,0
scam,Can you return the 1000 BDT I lent you <DATE_TIME>? Need it urgently,68,13,2,4.3076923076923075,False,0.0,True,False,False,0,False,False,0,1,True,0,False,0,False,0,1,2,4,0.058823529411764705,False,False,False,False,False,False,False,0
scam,Get 200% return by investing just $100 in our crypto program. Limited seats!,76,13,2,4.923076923076923,False,0.0,True,False,False,0,False,False,0,1,True,0,False,0,False,1,0,0,6,0.07894736842105263,False,False,False,False,False,False,False,0
ham,"Salary credited: 35,000 BDT has been deposited to your account",62,10,1,5.3,False,0.0,True,False,False,0,False,False,0,0,False,0,False,0,False,0,0,1,5,0.08064516129032258,False,False,False,False,False,False,False,0
scam,Claim your free cashback of $250 <DATE_TIME> by entering your card details,74,12,1,5.25,False,0.0,True,False,False,0,False,False,0,0,False,3,True,0,False,0,0,1,3,0.04054054054054054,False,False,False,False,False,False,False,0
scam,"Your Tax Refund of 20,000 BDT is pending. Submit your details to receive it instantly",85,15,2,4.733333333333333,False,0.0,True,False,False,0,False,False,0,1,True,0,False,0,False,0,0,1,5,0.058823529411764705,False,False,False,False,False,False,False,0
ham,"Nagad e 500 <PERSON>, mama. <PERSON>",36,6,2,5.166666666666667,False,0.0,True,False,False,0,False,False,0,0,False,0,False,0,False,0,0,2,3,0.08333333333333333,False,True,False,False,False,False,False,0
scam,Last chance! Clear your loan dues now to avoid legal action,59,11,2,4.454545454545454,False,0.0,True,False,False,0,False,False,0,2,True,0,False,0,False,1,0,0,0,0.0,False,False,False,False,False,False,False,0
ham,"Please approve the 12,500 BDT payment request I sent on Payoneer.",65,11,1,5.0,False,0.0,True,False,False,0,False,False,0,0,False,0,False,1,True,0,0,1,5,0.07692307692307693,False,False,False,False,False,False,False,0
scam,Win a brand new iPhone 15 by paying just $5 registration fee!,61,12,1,4.166666666666667,False,0.0,True,False,False,0,False,False,0,0,False,0,False,1,True,1,0,0,3,0.04918032786885246,False,False,False,False,False,False,False,0
scam,Your credit card has been temporarily blocked. Reactivate by verifying your PIN.,80,12,2,5.75,False,0.0,True,False,False,0,False,False,0,0,False,3,True,1,True,0,0,1,0,0.0,False,False,False,False,False,True,False,0
ham,Client sent the 40% advance <DATE_TIME>. Check the bank statement,65,10,2,5.6,False,0.0,True,False,False,0,False,False,0,0,False,0,False,0,False,0,0,1,2,0.03076923076923077,False,False,False,False,False,False,False,0
scam,Earn $300 per day without investment. Just forward messages!,60,9,2,5.777777777777778,False,0.0,True,False,False,0,False,False,0,0,False,0,False,0,False,1,0,0,3,0.05,False,False,False,False,False,False,False,0
ham,Can you share the bank details for transferring the rent money?,63,11,1,4.818181818181818,False,0.0,True,False,False,0,False,False,0,0,False,0,False,1,True,0,1,0,0,0.0,False,False,False,False,False,False,False,0
scam,"Your bank flagged a transaction of $1,250. Verify at <URL> within <DATE_TIME> to avoid suspension",97,15,2,5.533333333333333,False,0.0,True,False,False,0,False,False,0,0,False,1,True,1,True,0,0,2,4,0.041237113402061855,False,False,False,False,False,False,False,0
ham,"Sent 2,500 BDT via bKash just now. Please confirm when you get it",65,13,2,4.076923076923077,False,0.0,True,False,False,0,False,False,0,1,True,0,False,1,True,0,0,1,4,0.06153846153846154,True,False,False,False,False,False,False,0
scam,"Congratulations, you have been pre-approved for an instant $5,000 loan. Apply here to receive funds within <DATE_TIME>",118,17,2,6.0,False,0.0,True,False,False,0,False,False,0,1,True,0,False,0,False,0,0,1,4,0.03389830508474576,False,False,False,False,False,False,False,0
ham,"Invoice INV-3321 for 18,750 BDT has been paid and receipt uploaded to your email",80,14,1,4.785714285714286,False,0.0,True,False,False,0,False,False,0,0,False,0,False,0,False,0,0,2,9,0.1125,False,False,False,False,False,False,False,0
scam,Alert: Unusual login detected on your PayPal. Confirm identity to prevent account hold,86,13,2,5.6923076923076925,False,0.0,True,False,False,0,False,False,0,0,False,1,True,2,True,0,0,0,0,0.0,False,False,False,False,False,False,False,0
ham,"I transferred the rent 12,000 BDT to your account. Check and tell me if it cleared",82,16,2,4.1875,False,0.0,True,False,False,0,False,False,0,0,False,0,False,1,True,0,0,1,5,0.06097560975609756,False,False,False,False,False,False,False,0
scam,Limited offer: Get 15% cashback on utility bill payments. Submit card details to claim reward,93,15,2,5.266666666666667,False,0.0,True,False,False,0,False,False,0,1,True,4,True,1,True,0,0,0,2,0.021505376344086023,False,False,False,False,False,False,False,0
ham,"Company salary transfer of 45,000 BDT processed <DATE_TIME>. Payslip sent to your inbox",87,13,2,5.769230769230769,False,0.0,True,False,False,0,False,False,0,0,False,0,False,2,True,0,0,2,5,0.05747126436781609,False,False,False,False,False,False,False,0
scam,Immediate action required: Confirm your bank <PERSON> to stop a pending fraudulent transfer,91,13,1,6.076923076923077,False,0.0,True,False,False,0,False,False,0,0,False,0,False,2,True,0,0,1,0,0.0,False,False,False,False,False,False,False,0
ham,"I have paid the supplier 30,000 BDT via bank transfer; please confirm delivery schedule",87,14,1,5.285714285714286,False,0.0,True,False,False,0,False,False,0,0,False,0,False,2,True,0,0,1,5,0.05747126436781609,False,False,False,False,False,False,False,0
scam,"You are shortlisted for a high-return investment program. Invest $200 to get $2,000 <DATE_TIME> returns. Limited seats",118,17,3,6.0,False,0.0,True,False,False,0,False,False,0,1,True,0,False,0,False,0,0,1,7,0.059322033898305086,False,False,False,False,False,False,False,0
ham,"Shared the invoice for <DATE_TIME>. Please approve payment of 22,500 BDT by <DATE_TIME>",87,13,2,5.769230769230769,False,0.0,True,False,False,0,False,False,0,0,False,0,False,1,True,0,0,3,5,0.05747126436781609,False,False,False,False,False,False,False,0
scam,Final notice: Overdue loan amount of $850 must be cleared or legal action will follow. Click to resolve,103,18,2,4.777777777777778,False,0.0,True,False,False,0,False,False,0,0,False,0,False,1,True,0,0,0,3,0.02912621359223301,False,False,False,False,False,False,False,0
scam,Reward claim: Your tax refund of $420 is pending. Submit bank details to process immediately,92,15,2,5.2,False,0.0,True,False,False,0,False,False,0,1,True,2,True,0,False,0,0,0,3,0.03260869565217391,False,False,False,False,False,False,False,0
ham,"Payment confirmation: Received 4,200 BDT for the event booking. Thanks for the prompt payment",93,14,2,5.714285714285714,False,0.0,True,False,False,0,False,False,0,0,False,0,False,2,True,0,0,1,4,0.043010752688172046,False,False,False,False,False,False,False,0
scam,Urgent verification requested: Reactivate your debit card by confirming 4-digit PIN at <URL>rify,96,13,1,6.461538461538462,False,0.0,True,False,False,0,False,False,0,1,True,1,True,1,True,0,0,1,1,0.010416666666666666,False,False,False,False,False,True,False,0
ham,"I sent the freelance payment of $150 via Payoneer. Check and confirm receipt, please",84,14,2,5.071428571428571,False,0.0,True,False,False,0,False,False,0,0,False,1,True,2,True,0,0,0,3,0.03571428571428571,False,False,False,False,False,False,False,0
scam,"Exclusive: Instant credit limit increase to $3,000 available. Click link to accept the offer now",96,15,2,5.466666666666667,False,0.0,True,False,False,0,False,False,0,2,True,1,True,1,True,0,0,0,4,0.041666666666666664,False,False,False,False,False,False,False,0
ham,"Reminder: Utility bill of 1,250 BDT due <DATE_TIME>. Please pay to avoid late fee",81,14,2,4.857142857142857,False,0.0,True,False,False,0,False,False,0,0,False,0,False,1,True,0,0,2,4,0.04938271604938271,False,False,False,False,False,False,False,0
scam,Claim your cashback reward of $300 now. Complete the form to receive instant transfer,85,14,2,5.142857142857143,False,0.0,True,False,False,0,False,False,0,2,True,3,True,1,True,0,0,0,3,0.03529411764705882,False,False,False,False,False,False,False,0
ham,"Transferred 5,000 BDT for the project materials. Inform me when it arrives",74,12,2,5.25,False,0.0,True,False,False,0,False,False,0,0,False,0,False,1,True,0,0,1,4,0.05405405405405406,False,False,False,False,False,False,False,0
scam,Your credit score has been upgraded. Unlock premium loan access with zero documentation,87,13,2,5.769230769230769,False,0.0,True,False,False,0,False,False,0,0,False,0,False,0,False,0,0,0,0,0.0,False,False,False,False,False,False,False,0
ham,Sent the advance payment of $200 via Wise. Check your email for confirmation,76,13,2,4.923076923076923,False,0.0,True,False,False,0,False,False,0,0,False,0,False,2,True,0,0,0,3,0.039473684210526314,False,False,False,False,False,False,False,0
scam,"Lottery draw result: Your mobile number has won 75,000 BDT. Submit bank info to collect winning",95,16,2,5.0,False,0.0,True,False,False,0,False,False,0,0,False,2,True,0,False,0,0,1,5,0.05263157894736842,False,False,False,False,False,False,False,0
ham,I refunded the extra 850 BDT you sent earlier. Please recheck your balance,74,13,2,4.769230769230769,False,0.0,True,False,False,0,False,False,0,0,False,0,False,0,False,0,0,1,3,0.04054054054054054,False,False,False,False,False,False,False,0
scam,PayPal alert: Unverified login attempt blocked. Recover account before suspension,81,10,2,7.2,False,0.0,True,False,False,0,False,False,0,0,False,2,True,1,True,0,0,0,0,0.0,False,False,False,False,False,False,False,0
ham,"Final payment of 12,600 BDT processed successfully. Kindly send delivery schedule",81,11,2,6.454545454545454,False,0.0,True,False,False,0,False,False,0,0,False,0,False,2,True,0,0,1,5,0.06172839506172839,False,False,False,False,False,False,False,0
scam,Government relief fund available for selected citizens. Register to receive $500 instantly,90,12,2,6.583333333333333,False,0.0,True,False,False,0,False,False,0,1,True,0,False,1,True,0,0,0,3,0.03333333333333333,False,False,False,False,False,False,False,0
ham,"Rent of 9,000 BDT paid via Nagad. Let me know if it shows pending",65,14,2,3.7142857142857144,False,0.0,True,False,False,0,False,False,0,1,True,0,False,0,False,0,0,1,4,0.06153846153846154,False,True,False,False,False,False,False,0
scam,Your insurance refund request is approved. Submit billing address to release payment,84,12,2,6.083333333333333,False,0.0,True,False,False,0,False,False,0,0,False,0,False,1,True,0,0,0,0,0.0,False,False,False,False,False,False,False,0
ham,"Paid the tuition installment of 15,000 BDT <DATE_TIME>. Please confirm on your side",83,13,2,5.461538461538462,False,0.0,True,False,False,0,False,False,0,0,False,0,False,2,True,0,0,2,5,0.060240963855421686,False,False,False,False,False,False,False,0
scam,"Crypto investment deal: Deposit $100 and earn $1,000 <DATE_TIME> return guaranteed",82,11,1,6.545454545454546,False,0.0,True,False,False,0,False,False,0,0,False,0,False,0,False,0,0,1,7,0.08536585365853659,False,False,False,False,False,False,False,0
ham,"Can you send 2,300 BDT by <DATE_TIME>? Need to settle an urgent bill",68,13,2,4.3076923076923075,False,0.0,True,False,False,0,False,False,0,1,True,0,False,1,True,0,1,2,4,0.058823529411764705,False,False,False,False,False,False,False,0
scam,"Security alert: Suspicious transaction of 4,500 BDT detected on your card. Approve or decline immediately",105,15,2,6.066666666666666,False,0.0,True,False,False,0,False,False,0,1,True,1,True,0,False,0,0,1,4,0.0380952380952381,False,False,False,False,False,False,False,0
ham,Salary allowance of $120 added separately. Check your payroll slip,66,10,2,5.7,False,0.0,True,False,False,0,False,False,0,0,False,0,False,1,True,0,0,0,3,0.045454545454545456,False,False,False,False,False,False,False,0
scam,Your subscription payment failed. Update card details to avoid service halt,75,11,2,5.909090909090909,False,0.0,True,False,False,0,False,False,0,0,False,0,False,2,True,0,0,0,0,0.0,False,False,False,False,False,False,False,0
ham,Settled the vendor payment through bank draft just now. Awaiting your acknowledgment,84,12,2,6.083333333333333,False,0.0,True,False,False,0,False,False,0,1,True,0,False,1,True,0,0,0,0,0.0,False,False,False,False,False,False,False,0
scam,Limited stock: Get gold savings account with 5x bonus interest. Activate through special code,93,14,2,5.714285714285714,False,0.0,True,False,False,0,False,False,0,1,True,1,True,0,False,0,0,0,1,0.010752688172043012,False,False,False,False,False,False,False,0
ham,"Received 1,100 BDT on Rocket just now. Sending receipt shortly",62,10,2,5.3,False,0.0,True,False,False,0,False,False,0,1,True,0,False,1,True,0,0,1,4,0.06451612903225806,False,False,True,False,False,False,False,0
scam,Immediate action required to prevent permanent block on your debit card. Confirm identity at <URL>,98,15,2,5.6,False,0.0,True,False,False,0,False,False,0,0,False,0,False,1,True,0,0,1,0,0.0,False,False,False,False,False,False,False,0
ham,"Just sent 3,200 BDT to your account for the utility bills. Please check and confirm",83,15,2,4.6,False,0.0,True,False,False,0,False,False,0,0,False,0,False,1,True,0,0,1,4,0.04819277108433735,False,False,False,False,False,False,False,0
scam,"Exclusive loan offer of $10,000 with no credit check. Apply before <DATE_TIME>",78,12,2,5.583333333333333,False,0.0,True,False,False,0,False,False,0,0,False,1,True,0,False,0,0,1,5,0.0641025641025641,False,False,False,False,False,False,False,0
ham,"Client transferred 65,000 BDT <DATE_TIME>. Update the balance sheet",67,9,2,6.555555555555555,False,0.0,True,False,False,0,False,False,0,0,False,0,False,2,True,0,0,2,5,0.07462686567164178,False,False,False,False,False,False,False,0
scam,Final reminder: Your pending tax fee of $260 must be cleared to avoid penalty,77,14,1,4.571428571428571,False,0.0,True,False,False,0,False,False,0,0,False,0,False,0,False,0,0,0,3,0.03896103896103896,False,False,False,False,False,False,False,0
ham,"Your online order payment of 2,750 BDT is successfully received. Thank you",74,12,2,5.25,False,0.0,True,False,False,0,False,False,0,0,False,0,False,1,True,0,0,1,4,0.05405405405405406,False,False,False,False,False,False,False,0
scam,"Congratulations, your wallet has been credited with $700 bonus. Activate reward using secure link",97,14,2,6.0,False,0.0,True,False,False,0,False,False,0,0,False,2,True,0,False,0,0,0,3,0.030927835051546393,False,False,False,False,False,False,False,0
ham,"I will return your 1,500 BDT <DATE_TIME> once my salary arrives",63,11,1,4.818181818181818,False,0.0,True,False,False,0,False,False,0,0,False,0,False,0,False,0,0,2,4,0.06349206349206349,False,False,False,False,False,False,False,0
scam,Suspicious payment attempt detected on your MasterCard. Validate transaction immediately,88,10,2,7.9,False,0.0,True,False,False,0,False,False,0,1,True,0,False,1,True,0,0,0,0,0.0,False,False,False,False,False,False,False,0
ham,"Sent the advance booking amount of 5,500 BDT. Please reserve the slot",69,12,2,4.833333333333333,False,0.0,True,False,False,0,False,False,0,0,False,0,False,0,False,0,0,1,4,0.057971014492753624,False,False,False,False,False,False,False,0
scam,Your reward of $950 is waiting for withdrawal. Submit bank details to receive instantly,87,14,2,5.285714285714286,False,0.0,True,False,False,0,False,False,0,1,True,1,True,0,False,0,0,0,3,0.034482758620689655,False,False,False,False,False,False,False,0
ham,"I transferred 4,800 BDT for the exam fees. Please verify if it reached your account",83,15,2,4.6,False,0.0,True,False,False,0,False,False,0,0,False,1,True,2,True,0,0,1,4,0.04819277108433735,False,False,False,False,False,False,False,0
scam,Urgent notification: Loan recovery team assigned to your case. Clear dues to avoid legal visit,94,15,2,5.333333333333333,False,0.0,True,False,False,0,False,False,0,1,True,0,False,0,False,0,0,0,0,0.0,False,False,False,False,False,False,False,0
ham,"The vendor confirmed receipt of 22,000 BDT. Delivery will be dispatched <DATE_TIME>",83,12,2,6.0,False,0.0,True,False,False,0,False,False,0,0,False,0,False,1,True,0,0,2,5,0.060240963855421686,False,False,False,False,False,False,False,0
scam,"Increase your credit limit to $5,000 instantly without documentation. Click to activate",87,12,2,6.333333333333333,False,0.0,True,False,False,0,False,False,0,1,True,0,False,1,True,0,0,0,4,0.04597701149425287,False,False,False,False,False,False,False,0
ham,"Mom sent 1,200 BDT through Rocket. Check if it reflects in your balance",71,13,2,4.538461538461538,False,0.0,True,False,False,0,False,False,0,0,False,0,False,0,False,0,0,1,4,0.056338028169014086,False,False,True,False,False,False,False,0
